{
  "format": 1,
  "name": "Nord Dungeon 6: Light and shipping",
  "id": "com.crowelian.series-dungeon-6",
  "type": "2d",
  "engineVersion": "0.1.0",
  "startScene": "scenes/main.scene.json",
  "display": {
    "width": 640,
    "height": 360,
    "scale": "fit",
    "pixelArt": false,
    "background": "#14161c"
  },
  "physics": {
    "engine": "arcade",
    "gravity": [
      0,
      0,
      0
    ]
  },
  "input": {
    "actions": {
      "left": [
        "KeyA",
        "ArrowLeft"
      ],
      "right": [
        "KeyD",
        "ArrowRight"
      ],
      "up": [
        "KeyW",
        "ArrowUp"
      ],
      "down": [
        "KeyS",
        "ArrowDown"
      ],
      "interact": [
        "KeyE",
        "Enter"
      ]
    }
  }
}
