{
  "format": 1,
  "name": "FPS Creator",
  "id": "com.crowelian.fpscreator",
  "type": "3d",
  "engineVersion": "0.1.0",
  "startScene": "scenes/main.scene.json",
  "display": {
    "width": 1280,
    "height": 720,
    "scale": "fit",
    "pixelArt": false,
    "background": "#2e3440"
  },
  "physics": {
    "engine": "none",
    "gravity": [
      0,
      0,
      0
    ]
  },
  "input": {
    "actions": {}
  },
  "plugins": [],
  "ui": {
    "skin": "cyber",
    "theme": "nord"
  }
}
