{
  "format": 1,
  "name": "API check",
  "id": "com.crowelian.api-check",
  "type": "2d",
  "engineVersion": "0.0.1",
  "startScene": "scenes/main.scene.json",
  "display": {
    "width": 960,
    "height": 540,
    "scale": "fit",
    "pixelArt": false,
    "background": "#101418"
  },
  "physics": {
    "engine": "arcade",
    "gravity": [
      0,
      900,
      0
    ]
  },
  "input": {
    "actions": {
      "left": [
        "KeyA",
        "ArrowLeft"
      ],
      "right": [
        "KeyD",
        "ArrowRight"
      ],
      "up": [
        "KeyW"
      ],
      "down": [
        "KeyS"
      ],
      "jump": [
        "Space"
      ],
      "fire": [
        "Mouse0"
      ]
    }
  },
  "ui": {},
  "plugins": [],
  "export": {}
}