{
  "format": 1,
  "name": "Lights Out",
  "id": "com.crowelian.eslightsout",
  "type": "2d",
  "engineVersion": "0.1.0",
  "startScene": "scenes/main.scene.json",
  "display": {
    "width": 640,
    "height": 360,
    "scale": "fit",
    "pixelArt": false,
    "background": "#2e3440"
  },
  "physics": {
    "engine": "none",
    "gravity": [
      0,
      0,
      0
    ]
  },
  "input": {
    "actions": {}
  },
  "plugins": [
    "ui",
    "audio"
  ],
  "ui": {
    "skin": "cyber",
    "theme": "nord"
  }
}
