{
  "format": 1,
  "name": "Coin Dash",
  "id": "com.crowelian.coin-dash",
  "type": "2d",
  "engineVersion": "0.0.1",
  "startScene": "scenes/main.scene.json",
  "display": {
    "width": 960,
    "height": 540,
    "scale": "fit",
    "pixelArt": false,
    "background": "#1b2230"
  },
  "physics": {
    "engine": "arcade",
    "gravity": [
      0,
      0,
      0
    ]
  },
  "input": {
    "actions": {
      "left": [
        "KeyA",
        "ArrowLeft"
      ],
      "right": [
        "KeyD",
        "ArrowRight"
      ],
      "up": [
        "KeyW",
        "ArrowUp"
      ],
      "down": [
        "KeyS",
        "ArrowDown"
      ],
      "restart": [
        "KeyR",
        "Enter"
      ]
    }
  },
  "ui": {},
  "plugins": [],
  "export": {}
}
