{
  "format": 1,
  "name": "Machine Workshop",
  "id": "com.crowelian.machineworkshop",
  "type": "2d",
  "engineVersion": "0.1.0",
  "startScene": "scenes/main.scene.json",
  "display": {
    "width": 960,
    "height": 540,
    "scale": "fit",
    "pixelArt": true,
    "background": "#192631"
  },
  "physics": {
    "engine": "matter",
    "gravity": [
      0,
      900,
      0
    ]
  },
  "input": {
    "actions": {
      "left": [
        "KeyA",
        "ArrowLeft"
      ],
      "right": [
        "KeyD",
        "ArrowRight"
      ],
      "up": [
        "KeyW",
        "ArrowUp"
      ],
      "down": [
        "KeyS",
        "ArrowDown"
      ],
      "jump": [
        "Space"
      ],
      "dash": [
        "ShiftLeft"
      ],
      "interact": [
        "KeyE",
        "Enter"
      ]
    }
  },
  "plugins": [
    "ui",
    "audio"
  ],
  "ui": {
    "skin": "cyber",
    "theme": "nord"
  }
}
