{
  "format": 1,
  "name": "Endless Runner",
  "id": "com.crowelian.runner",
  "type": "2d",
  "engineVersion": "0.1.0",
  "startScene": "scenes/main.scene.json",
  "display": {
    "width": 640,
    "height": 360,
    "scale": "fit",
    "pixelArt": false,
    "background": "#5b8db8"
  },
  "physics": {
    "engine": "none",
    "gravity": [
      0,
      0,
      0
    ]
  },
  "input": {
    "actions": {
      "jump": [
        "Space",
        "ArrowUp",
        "KeyW",
        "Mouse0"
      ],
      "down": [
        "ArrowDown",
        "KeyS"
      ]
    }
  },
  "plugins": [
    "ui",
    "audio"
  ],
  "ui": {
    "skin": "cyber",
    "theme": "nord"
  }
}
