{
  "format": 1,
  "name": "Rust Asteroids",
  "id": "com.crowelian.rustasteroids",
  "type": "wasm-game",
  "engineVersion": "0.1.0",
  "startScene": "scenes/main.scene.json",
  "display": { "width": 640, "height": 360, "scale": "fit", "pixelArt": false, "background": "#0b0e18" },
  "physics": { "engine": "none", "gravity": [0, 0, 0] },
  "input": { "actions": { "left": ["KeyA", "ArrowLeft"], "right": ["KeyD", "ArrowRight"], "thrust": ["KeyW", "ArrowUp"], "fire": ["Space"], "restart": ["KeyR"] } },
  "plugins": []
}
